<?xml version="1.0" encoding="UTF-8"?>


<items xmlns:xsi = "http://www.w3.org/2001/XMLSchema-instance"
      xsi:noNamespaceSchemaLocation = "items.xsd"
>
    
    <item name = "banner" type = "BANNER" amount = "16" data = "0">
        <value buy = "10.00" sell = "50.00"/>
        <banner-meta display-name = "&amp;cItem">
            <enchantments>
                <enchantment type = "PROTECTION_ENVIRONMENTAL" level = "1"/>
            </enchantments>
            
            <description>
                <line>Line one</line>
                <line>Line Two</line>
            </description>
            
            <flags>
                <flag>HIDE_DESTROYS</flag>
            </flags>
            
            <patterns>
                <pattern type = "BORDER" color = "CYAN"/>
            </patterns>
        </banner-meta>
    </item>
    
    <item name = "written book" type = "WRITTEN_BOOK" amount = "16" data = "0">
        <value buy = "10.00" sell = "50.00"/>
        <book-meta display-name = "&amp;cItem" author = "Aldous Huxley" title = "&amp;cBrave New World">      
            <enchantments>
                <enchantment type = "PROTECTION_ENVIRONMENTAL" level = "3"/>
            </enchantments>
    
            <description>
                <line>Line 1</line>
                <line>Line 2</line>
            </description>
    
            <flags>
                <flag>HIDE_DESTROYS</flag>
            </flags>
    
            <pages>
                <page>&amp;cSQUAT grey building of only thirty-four stories.</page>
            </pages>
    
        </book-meta>
    </item>
    
    <item name = "raw beef" type = "RAW_BEEF" amount = "16" data = "0">
        <value buy = "10.00" sell = "50.00"/>
        <item-meta display-name = "&amp;cItem">
            <enchantments>
                <enchantment type = "PROTECTION_ENVIRONMENTAL" level = "3"/>
            </enchantments>
    
            <description>
                <line>Line 1</line>
                <line>Line 2</line>
            </description>
    
            <flags>
                <flag>HIDE_DESTROYS</flag>
            </flags>
        </item-meta>
    </item>
    
    <item name = "leather boots" type = "LEATHER_BOOTS" amount = "16" data = "0">
        <value buy = "10.00" sell = "50.00"/>
        <leather-armor-meta display-name = "&amp;cItem" r = "1" g = "2" b = "3">
      
            <enchantments>
                <enchantment type = "PROTECTION_ENVIRONMENTAL" level = "3"/>
            </enchantments>
    
            <description>
                <line>Line 1</line>
                <line>Line 2</line>
            </description>
    
            <flags>
                <flag>HIDE_DESTROYS</flag>
            </flags>
    
        </leather-armor-meta>
    </item>
    
    <item name = "potion" type = "POTION" amount = "16" data = "0">
        <value buy = "10.00" sell = "50.00"/>
        <potion-meta display-name = "&amp;cItem" color = "SILVER">
      
            <enchantments>
                <enchantment type = "PROTECTION_ENVIRONMENTAL" level = "3"/>
            </enchantments>
    
            <description>
                <line>Line 1</line>
                <line>Line 2</line>
            </description>
    
            <flags>
                <flag>HIDE_DESTROYS</flag>
            </flags>
    
            <effects>
                <effect type = "JUMP" duration = "10" level = "3" ambient = "true" particles = "true"/>
            </effects>
    
        </potion-meta>
    </item>
    
    <item name = "enchanted book" type = "ENCHANTED_BOOK" amount = "16" data = "0">
        <value buy = "10.00" sell = "50.00"/>
        <storage-meta display-name = "&amp;cItem">
      
            <enchantments>
                <enchantment type = "PROTECTION_ENVIRONMENTAL" level = "3"/>
            </enchantments>
    
            <description>
                <line>Line 1</line>
                <line>Line 2</line>
            </description>
    
            <flags>
                <flag>HIDE_DESTROYS</flag>
            </flags>
    
            <stored>
                <enchantment type = "PROTECTION_ENVIRONMENTAL" level = "3"/>
            </stored>
    
        </storage-meta>
    </item>
    
</items>
